Title,Body,URL,Score,Comments Count,Comments
Learn German Vocabulary whilst reading in English 🚀,,https://i.redd.it/6pu99399tem41.jpg,1892,91,"[""Hey, it's actually a funny way to learn some vocabulary. Sure that won't be enough and you must rely on other ways to learn the language (syntax, grammar, etc). But it seems to be a good way to get the vocabulary stuck in your head."", 'reading this as a german native hurts my brain hahaha', 'Aversion *to* sunlight', 'One picture of Dracula! A! A! A!', ""Purchased. As someone who is currently painfully fighting to learn German, I'll take all the help I can get."", ""It's Germangled. Sounds like every Amish I've ever talked to."", ""//edited b/c I was clearly exceedingly mistaken; there's a demand. Good job! You might want to add plural forms and make sure that plural words are distinct from feminine ones. Pronunciation doesn't seem to be an issue with the audience, so I don't see why I should have a problem with it, upon reflection. Good work!"", 'Learning isolated words is never a good idea.', ""The lack of a hyphen in 'animal like' and the comma after bother me."", 'That\'s pretty cool actually, but it should say ""animal-like"".', 'This is so useful! Thank you!', ""I could see that one could improve with their vocabulary with this, but I fear they'd end up with some atrocious syntax and grammar"", 'All of those have cognates in English. I don’t know if it work as well for words without cognates.', ""That's pretty cool, but I would be worried that it would cause me to mix up English and German"", 'I like it! Do you have a Spanish version?', '.', 'I had not thought of using such a technique for studying, but I do remember picking up some slavic (-based) words while reading A Clockwork Orange without any effort a few years ago. Might be worth a try!', 'This is great!!', 'This is incredibly clever 😅', 'This is a cool way to learn! Good idea to use a public domain book for this.\n\nClever to have the difficulty slider, so it stays interesting. In the future you could do really cool AI stuff with this technique, like have the next page automatically adjust which words/sentences are translated based on which words you hovered over to translate.\n\nWould be so great to read through the Sherlock Holmes series and have the books gradually turn into German based on your ability to understand.', ""I've had decent success doing the reverse of this; learning the grammar of a brand-new language by studying sentences with the content words subbed out for English. gradually add back the target language words"", ""Zähne should be blue not red. It's a male noun."", 'Wonderful and creative way to get vocabulary. I hope somebody does this for Russian at some point', ""Shouldn't it be the opposite? A text in German with all English words?"", 'May I share my referal code for the website?\n\n \n\n#### https://language-mate.com/?referral=f6d1696f8578d341722c429d', 'Maybe not a bad idea. Especially if you could match the amount of German with known words', 'Does this have Spanish or Japanese?', 'Why did I read this in a very mad German accent?', 'Thanks I really appreciate that! \n\nThat’s the idea exactly. It is meant to accompany you whilst you learn grammar independently, maybe through a language class. It’s aim is to help you enjoy learning vocabulary in a time effective way. \n\nThe colours also represent the different genders too (blue - masculine, red - feminine/plural, green - neuter)', 'Haha, did you notice any difference when reading it or did it all flow?', '> that hurts my Hirn \n\nis what I commented earlier today', 'Happy cake day!', 'You’re amazing! Thank you. If you have any questions, or need any help, then send me a message and I’ll get back to you. \n\nGood luck with learning German, you’ll get there!', 'I spent a few days with a Chinese fellow who knows German better than he knows English (and his English was great). When we spoke, it was exactly like this. Great times. :3', 'Hi I have addressed the genders with the colours as I agree it is very important to learn the genders. And plurals appear in the book in the save way so you can also learn the Plural forms. \n\nI understand you issue with pronunciation. We will be making audio to go with it to help though. The challenge will be to make it seamless as you say. \n\nA point to note though, is that when you read in general, you don’t get pronunciation at all. But the main purpose is to read enjoyable content and to pick up new vocabulary that you can recognise in the future\n\nThanks for the feedback, I appreciate it!', 'It won’t help you learn grammar, but there is research showing this technique to be effective for learning vocabulary! And learning vocabulary is often the part of learning a language people neglect', 'I agree completely.  \n\n\nI think the technique is valid in principle, but there\'s no reason why they can\'t contextualize the vocabulary in simple German sentences, or with pictures and arrows that provide context too if they\'re beginners. But if they\'re beginners, they probably won\'t need to learn ""complexion"" (at least what\'s what I understood), if they\'re intermediate I think they can handle the sentences in German.', '""Never""', ""I would love this as a review tool. For me, it'd be great to see in Japanese, because I remember the grammar (pretty simple) and a lot of words, but I've completely forgotten most Kanji I learned (not a lot to begin with)."", 'I respectfully disagree. They increase your vocabulary, and can provide an anchor in a sentence that allow you to discern the meaning in a context. I look up individual words all the time. It especially helps me when listening to the language spoken.', 'This kind of tool seems like an accessible way to start, especially for someone who is feeling overwhelmed.', 'I think it looks good. I’ve learned loads of isolated words on Drops and then switched to Duo to pick up more of the grammar. It’s definitely fine. \n\nAnd I like this way of doing it, seems like a great idea. It feels like learning a new word in English and doesn’t feel like your brain is making an effort, so it seems like a great way to expand your vocabulary in ‘easy mode’.', ""Totally agree. I might go as far as to say that learning vocabulary as isolated words isn't a good use of time in general. If you can then it's better to just use all the time you have to read actual text when you want to work on vocab. At least this is my experience."", 'Hey! Unfortunately not yet, but I would love to make one. You can try the main website [here](https://language-mate.com) to go over Spanish whilst reading news articles though!', 'Thank you! I am glad you like it. Did you try the demo?', 'That’s really interesting! I could imagine that worked very well', 'You are right, but it is red because it is plural in this case', ""Probably not quite what you're looking for, but there's [https://en.wikipedia.org/wiki/A\\_Clockwork\\_Orange\\_(novel)](https://en.wikipedia.org/wiki/A_Clockwork_Orange_(novel))."", 'Not yet unfortunately! Spanish would hopefully be in the next few months 😃', '[deleted]', 'You should make a Crome extension that swaps out every twelfth word in webpages with the words translation in a foreign language', ""i'm not a native but i do know german and for me the text flowed well enough but i put a mental emphasis on every german word. maybe because it had a different colour, maybe because it was in german, i don't know."", 'I just read the first sentence and it already confused me a little. The sudden unexpected change between english and german is a bit confusing to me but i got used to it. \ni think learning like this helps only some specific kind of people, for me it completely threw me off, even though i can speak english and german fluently', 'It makes me feel icky. It feels [like this](https://www.youtube.com/watch?v=yxwXozLR2IA).', 'AHHHHBHH NO STOP', ""Hi! Good to meet you. In that case, it just might be a good idea to separate feminine words from plural words. It seems like right now they're both red."", 'maybe a very useful follow up activity would be to provide the same text but all in German, as they will have the keywords understood, the grammar will fall into place because they know the meaning, and then some comprehension questions. ""Is his skin pale or tanned?"" etc.\n\nIt\'s like when people learn a language by reading a book they know very well in their own language, like Harry Potter. They know the meaningful moments, so they can piece together the rest of the language.', 'Could you link the research? I would be interested in reading it.', 'Can you link the research please?', ""But what happens when it's not obvious what the noun is?\n\nWhat about when the learner can only relate it back to their L1 so they end up having to think in English and then end up translating in their head when they should simply be speaking?\n\nJust reading in the target language is much more effective than this."", ""Gesicht means 'face', so it's beginner vocabulary.\n\nMaybe it could make the vocabulary more fun to learn for beginners. Of course it depends on the person, someone more visual could have better luck with pictures."", ""'Gesicht' is not 'complexion' it's 'face' \nBut I totally get, why 'complexion' is what you think it means ^^"", 'I AM THE LANGUAGE GOD AND ONLY MY WAY IS RIGHT', 'IMO it would be more helpful to reflect the base gender of the noun. Either use that color straight up, or vary it somehow for plurals (e.g. use a lighter shade of red, blue, or green)', 'I’ve heard of it, wasn’t aware it had some Russian in it. Thank you!', 'Oh no, I’m sorry! What colour scheme would work best for you?', 'There are already several of these. ""Language Immersion"", ""Vocablurry"", and ""Vocab Swap"" among them.', 'ククク', 'I really like that idea, thanks! I am going to make additional resources that go with it to cover pronunciation for example, but I hadn’t thought of that idea. \nYes, it follows similar principals as reading a book you already know but I’ve made it so you don’t have to read the book beforehand in English.', 'Completely agree. This is how my French immersion class worked in elementary school. Not a single word was spoken in English, and the teacher would tell fairy tales in French. I remember the first day I understood she was telling us the story of ""Goldilocks and the Three Bears"". And I realized after that I was understanding ""Hansel and Gretel"", ""Green Eggs and Ham"", etc.\n\nI was an exchange student in HS at a lycée in Paris, and I started dreaming in French. That was pretty freaky. When I came back, I asked my Ukrainian baba if she dreamt in more than one language - and of course she did. My dad & baba would mix in Ukrainian while speaking English, but we were never taught any we didn\'t hear regularly. I\'m guessing it was due to still being the Cold War.', ""I'm an L2 English speaker and speak several other languages though so experience is my teacher and i talk from experience. I don't have a study nor do i think i need one to make the point i made."", ""Don't have any. \n\nBesides, research would simply be show students this, get them to do a test where they recognise these words, see how well they do. \n\nIt's hardly applicable to real life."", 'Well then we have a problem because I assumed it was skin.', 'Thanks for the comment. It is beginner vocabulary. I mainly wanted to make learning vocabulary fit into your daily routine so that it didn’t feel like a big time sink!', ""It's more of a slang, with words derived from Russian.  Not sure if you followed the link in the article on Nadsat, but it gets into some detail.\nThe book itself is pretty dark, but a good read with some interesting thoughts."", 'For color blindness, there isn\'t any ""safe"" scheme. Some people only see in gray shades. If you want to make this works for anyone (who isn\'t totally blind) you have to add other clues. Usually websites use a little badge next to the words.\n\nIf you want to take even one more step to make this accessible for as many people as possible, you could use HTML instead of pictures. Blind people use softwares to have web pages read out loud for them, or some kind of ""screens"" they can touch to read words in Braille.\n\nHTML pages can also be manipulated by web browsers to make the font bigger, which is good for people with low vision.\n\nYou may not feel comfortable with the idea of producing HTML pages by yourself, we could have a look together. I\'m not an accessibility specialist, but I know enough to create a basic template page that would probably do the trick. If you think you would use it of course 🙂', 'It might be best to just let the user pick the colors.', 'Using other formatting instead of colors like underlining, italics, bold, capital letters etc. might work', ""I don't quite agree with the other colourblinds. Even achromats (greyscale vision) would be able to tell a difference between them if the brightness of the colours are different.\n\nI think more contrasting sharply defined colours would help, as well as avoiding green. Make the other colours either dark or light. This should all help. Perhaps swapping out the green for a bright yellow?"", ""As someone with synesthesia, the colors are really disorienting and I'd love the option to just have the words underlined. Grapheme-color synesthesia is when you perceive words to be certain colors. For example, I perceive the word Vokabeln as green so it is confusing to see it written in red. \n\nEven for people without synesthesia though, I think putting the words for blood and sunlight in counterintuitive colors isn't super helpful. Why wouldn't Blut be red and Sonnenlicht be yellow?"", 'COOl!', 'I agree with you that learning isolated words isn’t gonna help. I was asking OP (who I replied to) for research. \n\nI also speak other languages but I won’t claim that my experience supersedes peer-reviewed research. OPs point was that research claimed his method successful. I am skeptical at that so I would like to read the research he mentioned.', 'Yeah same', 'I also thought it meant skin.', ""Damn that's nice"", 'as a webdev, thank u!', ""Apologies, it first showed up as a reply to me, or so i thought.\n\nI don't see why anyone with experience would cede to peer review research though. It's not an authority just because it's peer reviewed.\n\nPeople who have trodden the path know what works. A lot of peer review is bogus and/or bought and paid for."", 'Just because something worked for me in the past doesn’t mean there aren’t better ways to do it. When I learned my first language, it worked. I have since found better ways to learn and applied that to the next languages. Experience worked but using alternative methods worked better. Also, I don’t know where you are finding peer reviewed papers where every researcher and all the peers who review it have been paid to skew the results but you should really report that or stop reading the journals that publish them. \n\nFor OP, I’m sure you could spend 10 hours on this platform and come out with some basic vocabulary and you could call that successful but it would only really be considered successful if it was compared to other methods. Perhaps this method is more successful in retention, immediate recall or comprehension. But I imagine it is at the expense of other metrics. This is what I am interested it. I wouldn’t know that from experience, how effective methods are against others for certain skills against others and how detrimental they are against certain skills and whether that balances out or provides a ‘net gain’ in skills but if you can answer that from experience of learning a few languages then you must have picked up enough information along the way to get yourself a linguistics degree. \n\nI’m not only interested in learning languages but also in the act of language learning and acquisition and these are two very different things.', ""https://www.ncbi.nlm.nih.gov/pmc/articles/PMC3190555/\nHappens in medicine. And i also said 'a lot of' not 'all' or 'every' as you claim here.""]"
Parallel reading apps?,"Hey guys! 

I'm wondering if you guys know of any apps where I can read parallel like shown in the photo above. It's from Promova but after being subscribed, it seems they don't have that option? Lol

Any suggestions? Thanks!",https://i.redd.it/st5nfo7wisoc1.jpeg,223,51,"[""I don't think Don Quixote is an easy spanish book."", ""This dude's profile is crazy 💀"", ""Native Spanish speaker here. Don Quixote's Spanish has some differences with modern Spanish since it's a book written 400 years ago. I have read less than 200 pages (it's about 800 pages long) and in every page you have to look for the footnotes to know what 1 or 5 words mean, in, every, page."", 'Readlang', 'Definer (chrome extension) and LingQ (paid subscription model app)', 'Beelinguapp is better.', 'A LingQ subscription would be more cost effective in the long run as you would then be able to import materials and read them in the LingQ reader.', 'The absolute best parallel reading app that displays translations over the words is [WordDumb](https://github.com/xxyzz/WordDumb): You can use it with any book, it will add its translations automatically.', ""If you're open to using older technology, I'd recommend considering getting the same book in your target language and in another language you feel comfortable with, then reading them both in parallel. I've been doing this myself, and I'm very pleased with the results I've achieved so far."", ""lmao, the words don't like up at all"", 'LingQ has got stuff like that', 'LingQ. By default you have to click the word(s) to see the translation but there is a setting that makes it look like this.', 'Here: https://youtu.be/U_SAcVGFpag?si=fgEIwlEHI4chmeWm', 'Smart Book (android)', ""No, but I don't think this one works a lot either. Especially if the read you've picked is Don Quijote de la Mancha. It has a massive amount of outdated words in comparison to what many Spaniards would understand."", 'Imho the best application for reading in your target language and being able to quickly check the translation of the words or sentences and save those new words to the cards is DuoCards. \nThe free tier is ok, it lets you study up to 20 mins a day, the paid version is cheaper than other options on the market.', 'For spoon-feeding parallel sentences with glosses, you can check out the mobile [webapp](https://getemulate.com) I made about a year ago (original post [here](https://www.reddit.com/r/languagelearning/comments/121g8xt/my_favorite_way_to_dive_into_a_language_is_now_a/)). You can use it for free, the premium option just gives you better audio quality. I will be adding more content on there soon.', 'what is ‘quevivía’ ?', 'What is it application on your screenshot?', ""I like Beelinguapp, the personal dictionary is kinda glitchy, at least for me, but I like it and it's helped me a lot."", 'We want to add something like that to Qlango very soon, but short interesting fact stories. 100 words, in different levels. I hope we succeed. ☺️', ""It's like learning modern English with fucking Hamlet"", '""La razón de la sinrazón, que a mi razón se hace, de tal manera mi razón enflaquece, que con razón me quejo de la vuestra fermosura.""\n\nTranslation: ""The reason for the unreason, that to my reason does itself, in which manner my reason weakens, that with reason I complain of thy feauty."" (beauty is intentionally misspelled for *reason*s)\n\nYeah, totally a beginners level book.\n\nEdit: the translation I had copied translated it incorrectly in several ways... fixed now. To my point.', 'The Napoleonite post 😀', 'HAHAHHAHA WHAT THE FUUUU', 'Random stalking', 'do you have any book recommendations in place of don quixote?', 'Exageras, Si bien Don Quijote tiene algunas palabras arcaicas pero no es tanto como lo haces ver.\nAl menos en mi colegio nos lo hicieron leer junto con el Cid Campeador en primer año de secundaria.', 'Thank youuu!', 'Lute as an application to run on your laptop. [https://github.com/jzohrab/lute-v3](https://github.com/jzohrab/lute-v3)', ""I second this. Using it for French and it really helps with pronunciation because you can select text and it'll read it out loud to you. you can also select text and it will give you definitions."", 'Take a book, take a picture of a page, upload it to google translate. You get the translation, you get the pronunciations. Also reading with kindle offers something like that. Whispersync with audible. But mostly for English, I think.', 'I dont know the other languages, but it was a good spanish pronunciation', 'Thanks for the Rick Roll 👍', ""Also, I know this is just an ad, but one thing that irks me is that the word _mucho_ is highlighted, meanwhile _galgo, duelos, quebrantos, lentejas, astillero, etc._ aren't. Like I am pretty sure a person even considering reading Don Quixote in spanish would know what the word _mucho_ means."", 'I didn’t believe you until I checked and that monarchist shit is wild. Figures they’re Canadian too', ""El libro de la imaginación by Edmundo Valadés.\nMy dad has some career in literature and that's what he recommends you."", ""Search for don quixote or any other book but in level A1, A2, B1, B2. There are quite some out there. Earlier there were mostly English books, French was also very good covered, obly lately there are more and more books in German, Spanish, Italian. There are Olly Richards books in many more languages (Dutch, Korean, Arabic, ...). They are good enough, stories are his, so they aren't popular, but interesting enough.\n\nI've read tons of French classics at different levels. I loved it. No parallel books though. Lately I'm reading Italian comics (Zagor, Tex Wiler) and Polish erotic books (365 days). I try to read books in original.\n\nToomics is an interesting site with comics too.\n\nAlmost none are for free, but many of them are in French, Italian, Spanish libraries in many cities around the world (Italian ambassy, instute francais, instituto cervantes). I'm member of Institute Feancais and they have an online library. Maybe cervantes also has something like it."", 'Y estás seguro de que era el texto original y no una versión simplificada?', 'No solo son palabras arcaicas sino también cuestiones culturales: yo por ejemplo pensaba que ""duelos y quebrantos"" era una forma irónica de decir que los sábados no comía nada pero resulta que es un plato que existe.\n\nO sea, se puede leer con anotaciones, y hasta cierto punto se puede entender algo sin ellas, pero no es un texto para aprendices de castellano.', 'Como dice otro comentario, las versiones que te hacen leer en el colegio suelen ser versiones simplificadas o adaptadas a un lenguaje más moderno', 'No prooooooooblem', 'That was a post where guy rates language learning apps, free and paid', ""I've studied Spanish for many years and am good enough to read most modern literature, including things like 100 Years of Solitude or The Shadow of the Wind, but I don't even know most of those words."", 'If you read further down as well, the translations just completely stop being correct', 'Si, un familiar tenia y no use la simplificada como el resto.🙃', 'Exacto, a eso me refiero, hay muchas cuestiones culturales que se han perdido como es natural después de haber ocurrido 400 años. También noté la presencia de algunos ""falsos amigos"", o sea, frases o palabras que crees que entendiste pero en el pie de nota significa algo totalmente diferente. Además dudo que todo eso lo haya apreciado un adolescente de secundaria.', '!!!!', ""I'm a native Spanish speaker and also don't know many of this words lol"", 'I can’t read a lick of Spanish and I also don’t know these words. We should start a club!']"
