Title,Body,URL,Score,Comments Count,Comments
10 Tips for Language Learners,"I love learning languages and I am currently on my 5th language, German. I speak English, French, Mandarin and Spanish and after German, I plan on learning Italian and Portuguese.

Here are 10 tips I have for language learners that I have found helpful in my own language learning journey:

**Speaking**

Tip #1: Find native speakers to chat with through apps like HELLOTALK and TANDEM. I've made many friends all over the world through these language exchange apps and have had a chance to meet quite a few of them in real life. You may need to do some filtering on these apps though, because like with any social media apps, you're going to come across creeps who aren't there for the intended purpose of the app. But with some patience, you'll be able to make those quality connections to help your language learning as well as to build long-lasting friendships. If you are a shy person or don't like to talk to strangers online, just remember that you're completely anonymous and if you don't want to continue talking with someone, you have every right to leave the conversation.

Tip #2: Look on [MEETUP.com](https://meetups.com/) for language exchange groups in your area. Many cities have a MUNDOLINGO group where you just show up, tape some flag stickers on your shirt in descending order of your language proficiencies and walk around and converse with people who have flags of the languages you want to practice. It's a very friendly environment and especially if you're new to a city, it's a great way to meet new people.

**Listening**

Tip #3: I love the COFFEE BREAK LANGUAGE podcasts and I'm currently listening through the German series. They offer French, Spanish, Mandarin, German, Italian, English and Swedish podcasts at the moment. It takes you from basic grammar to more intermediate level conversations and the lessons are fun and applicable. Other ways to improve your listening is simply to listen to podcasts in your target language. CASTBOX is a great app for free podcasts.

Tip #4: If you have NETFLIX, you can turn your binge-watching into a language learning experience with two Google Chrome Extensions. NFLXMULTISUBS is an extension that allows you to turn on subtitles of two languages at the same time and LANGUAGE LEARNING WITH NETFLIX gives you a fully translated dialogue on the side of the screen as well as auto-pause after every sentence to give you time to learn some new vocabulary/phrases before moving on. If you want to access Netflix shows/movies from a different country, you can install a VPN (I would recommend ExpressVPN) and change your location to another country to watch its shows/movies.

**Reading**

Tip #5: If you are at an intermediate/advanced level, try reading the news or novels in the target language. I like to re-read novels I've already read in English because I already know the plot and it makes it a lot easier to understand in a different language. The Harry Potter series is a great series to do this exercise.

Tip #6: If you are a beginner, you can try an app called BEELINGUA which has bilingual short stories. Your screen will be split into two, one language on top and another on the bottom, and when you don't understand a phrase, simply highlight it and it will highlight the same section in the other language. Reading children stories is generally a good idea to pick up new and commonly used vocabulary and phrases.

**Writing**

Tip #7: Write a daily journal in your target language (maybe 10 minutes a day) about what you did that day, what you learned and what's on your mind. I found this exercise very helpful because you are training your brain to think in the target language. You'll also find that there are many words you don't know or thoughts you can't express in the target language, so this gives you a chance to look up those words/phrases and learn them. When I was learning Spanish last year and traveling in Australia/New Zealand, I decided to write my travel journal in Spanish. Although it was extremely challenging, I learned a lot of new vocabulary and phrases just from translating words and sentences that I didn't know. Even though the grammar was nowhere near perfect, it at least gets you in the mindset of thinking in a different language and trying to express yourself through writing in that language.

**Vocabulary**

Tip #8: You may be asking, ""so what do I do with all this new vocabulary and phrases that I've accumulated through the previous 7 tips?"" I would recommend an app called ANKIDROID which allows you to create your own flashcards. It's very simple to use and you can put all your new vocabulary and phrases there and do some memory practices every day.

**Grammar**

Tip #9: There are many free grammar textbooks online that you can download and do exercises in. If you would like some grammar books in Spanish or German, feel free to send me a message and I can email them to you.

Tip #10: Lastly, I recommend BABBEL for learning basic grammar of a language. It's an excellent and simple website that takes you through the beginner to intermediate levels of a language with practical exercises that put the grammar to use through conversations. BABBEL is the only recommendation in this post that is paid, but if you want to try a free month of BABBEL, send me a message and I can send you a referral :)

**Bonus tip for those who know multiple languages:** As you learn a new language, learn it through the lens of another language you already know. For example, I'm currently learning German through French on Babbel, so as I'm learning German, I'm also reviewing my French at the same time.

I hope you've found some of these tips helpful! Let me know which ones you've already tried and which ones you've liked or disliked. I would love to hear your tips for language learning as well!

Edit: If you want to try Babbel for a month for free, you can use this link: [https://www.talkable.com/x/djAyBX](https://www.talkable.com/x/djAyBX)",https://www.reddit.com/r/languagelearning/comments/hu2p47/10_tips_for_language_learners/,1377,190,"['The only tip I disagree with is Netflix, at least for me. If I watch any show with either English audio or English subs I learn absolutely nothing. My brain just sticks to my native language in order to understand and my target language (Polish) is ignored and I absorb nothing. The only way I can learn from Netflix is watching in my target language with target language subs.', ""Thanks! These tips are very helpful.\nI come from Germany and want to improve my English and French skills. I would also like to add that Reddit is a very nice possibility to make language progress. Especially when you want to improve your English skills because it's easy to join discussions from native American speakers."", ""Useful tips! Only thing I'd add is that you shouldn't wait until intermediate or advanced to read what you want (graded readers and short stories are both great) but if there's something you want to read and don't mind not understanding everything go for it.\n\nLastly, Listening-reading method is great (at any level). Great for beginners to learn pronunciation and grammar / some vocab. Great for more advanced learners to get a lot of quality input"", ""I love coffee break language, they're really good"", ""Hey nice post, i'm starting to learn french but i'm getting a bit frustrating. How do you measure beginners progress? I was doing my anki vocab but I hit a point where words alone didnt make much sense. So i started reading some stephen king, i like it, i learn new tenses and learn how to use new words and it helps me see the french grammar patterns but its a bit slow of a learning process and i get tiried quiclkly. I dont know if i'm doing it right!"", 'Thanks for the list! For Beelingua, can you set your native language to something other than English?', ""Beelingua is one of the best apps out there for begginers/intermediate. Simple stories, news, and they allow you to read in splitscreen on two languages. Translation on tap and audio. They also have a subscription that allows you to make cards and stuff but I use the free version myself.\n\nNow, for the extention for Netflix/google chrome, does anyone knows any for Firefox? I've been looking for one for some time and can't find any =/"", ""Hello\n\nHow long did it take you to learn 3 additional languages? I'm 22 years old right now and would like to speak a good amount of languages by the time I'm 30. What would be the best approach to doing so?"", 'I think Busuu is better than Babbel, but overall I like these tips.', ""How do you manage to keep your skills sharp with all the languages you've learned before while devoting lots of time for another one?"", '[deleted]', 'Im German how are you learning it? How do you learn the nouns with their genders? It hurts my brain with how hard nouns are to remember because of gender', ""Thanks for telling us about those apps... I'll definitely check them out!"", ""Interpals is also pretty cool for finding natives. It does seem to have a larger than normal base of creeps, but it's pretty easy to ignore."", 'This is wonderful! I was just wondering good ways and a few scrolls down here this is!! Thanks :)', 'This is a pretty good list.\n\nI love Babbel as it\'s pretty close to how textbooks are structured, and the only app I\'ve personally used so far that actually explains and trains grammar.\n\nFor some fun French listening/reading practice, I can highly recommend the kid\'s show ""Lou!"", which is available on Youtube (all 52 episodes, each episode just below 13 minutes long, with the option to toggle on French subtitles).\n\nFor Mandarin Chinese, the app Du Chinese offers a lot of graded reading/listening material with the options to toggle on/off pinyin and translation, as well as being able to listen to the texts in varying speeds. (They have some content available for free; full access is behind a pay wall.)\n\nIn exchange, does anyone have tipps for me for Icelandic resources? I can\'t use anything paper, so I\'m looking for apps and/or websites (apps preferred). The only one of my apps that has Icelandic so far is Drops (a vocabulary app) :/', 'thank you so much for this! i’ve been feeling discouraged lately but this was super helpful 🥰', 'Thank you for your post. I can’t wait to try this recommendations specially for my kids.', 'Quite a handy list you have there!  Thanks!', 'Thanks for these tips! Also follow people of your target language on social media and watch their videos.', 'I’m currently on my fourth language which is kinda a lie since I learnt three as a kid. I’m currently studying French and I do all the things exactly as you mentioned. Makes me happy to know I’m on the right track. Thank you!', 'Thank you for this!!!', 'In German how are you learning it? How do you learn the nouns with their genders? It hurts my brain with how hard nouns are to remember because of gender', 'Gracias por tu post, es muy util, espero mejorar mi ingles con esto.', 'Thank you teacher for the tips,  I found very useful and I didn´t know them.  I was in your recently class in open english like Tatiana.  Have a good day.', 'We need more quality posts like these on this sub. Great job, OP.', ""I have the app Hello Chinese for Chinese. I haven't been doing it recently, but when I did it before I had  the app in Spanish, my second language, to learn Chinese, my third language. So I was learning Chinese in Spanish. It was so fun. So I just wanna add here that yes that is a good tip. It's really fun for me two have two languages going simultaneously and completely bypass English my native tongue.\n\nI think these are good tips and I appreciate the post. I see plenty of things I already have done and continue to do for Spanish."", 'Excellent resources. I would say ANKIDROID is the android version, but anyone can use the regular free online version [https://ankiweb.net/about](https://ankiweb.net/about)', 'related to your last tip, i\'m trying to learn italian from 0 atm, i\'ve tried with french but it was a long time ago, the case is i was learning it from english (aka my second language, my first is spanish) i too thought that it\'ll help me solidify my english if i tried learning another language in it but if the language is already really similar to spanish would it be faster to learn spanish-->italian than english-->italian?? the problem i had with french was the genre of the words, like in english you have ""the"" but in spanish is ""la/el"" much more similar to french, so it slowed me a bit', 'Kudos to you! I’m curious as to how long you’ve been learning languages! Are these tips all of the ways you’ve managed to learn so many?', 'Thank you OP for these tips.', '[deleted]', 'Awesome list. This is exactly the useful information I come to this sub for. Really apprediate your work.', 'What if you’re learning a language that isn’t as common as German? I’m trying to learn Darija.', 'Thank you very much! This does help a lot 🥰', 'Do you know if the Coffee Break Podcast will make a Dutch version ever?', ""When would you recommend using the speaking apps like tandem? I just started with German A1 level and I'd assume it wouldn't help me much. It would be great if you could've listed the tips in some order of progression"", 'imagine having a coffeebreak podcast in your target language :’(', 'Wait how old are you', 'How long did it take you to learn mandarin?', 'For some strange reason I can’t send you a message but I’d like to get these german textbooks you mentioned!', 'Hi teacher. Thanks for this tips....I am from Openenglish. I am looking for app that could help me memoriaze new vocabulary....bye', ' Thank you for sharing this content! I just started learning English on OpenEnglish and these tips will help me a lot! Good job!', 'How do you connect with a native speaker for conversation?  With COVID and social distancing I’m trying to find a native French speaker on line (for free) to speak with. I’m very beginning and can read the basics but if I *hear* it I feel quite lost.', 'This is a pretty good list. I have been learning the [Japanese language](https://vocab.chat/en/wl/guest2/100%20japanese%20words) for the last few weeks and have been creating my own vocabulary list with Vocab.chat that I can access whenever I want. All in all, it’s been an amazing language learning experience.', ""These are useful tips and sound pretty easy to realize. Unfortunately, if you got a family and a full-time job it's not that easy :-(\n\nThe most difficult thing for me is the pronunciation since I don't can effort the time to join an exchange group.\n\nI'll give your recommended apps a try. After checking both of them out quickly they looks very useful and quite simple to implement in my daily routine. Thanks for that."", 'Is there any way that is more legal than using a VPN to get foreign shows?', 'Thanks, very helpful!', 'I’m learning Shanghainese, so I don’t really have a lot of resources at my disposal. Any advice on how I should study it?', ""Any tips on things to look for in meetup? First of all, I'd feel nervous going to a conversation hour if my language skills weren't at least B1 (maybe better to focus on the basics before that point anyway).\n\nBut in my city (not NYC or LA, but one of the bigger cities in the US), I've only seen meetups for German Stammtisch, none of the less common languages I study. But even then, everyone in the group is 30+ years older than me, I doubt I'd have much in common with them. Of course meetup isn't a great thing with COVID for the time being anyway.\n\n> Bonus tip for those who know multiple languages: As you learn a new language, learn it through the lens of another language you already know.\n\nI do this. For my other languages, I look for a teacher online (italki etc.) who speaks German as well. That way I can ask specific questions from the viewpoint of German, which is helpful.\n\nThe tandem thing I've never used. I assume it'd be online just because outside of the main languages, you likely won't find speakers if you don't live in the right city. I'd rather just pay for a 1-hour lesson than do half-English/half-target-language. But I understand this is a good option for people with limited finances.\n\nIf you can find movies or TV shows in your TL, that's a great idea. Even if you can't, but can find subtitles to print out for one of your favorite shows, that's also helpful. If you know the show well enough, you don't even have to watch along, just read the script and you'll visualize/remember the scenes."", ""These are all great tips, thank you!. #'s 4 and 10 are particularly interesting to me. I'm learning Japanese and fluent in Italian and French with passable German and Spanish and the idea of approaching Japanese through a third language isn't just good for reviewing another language but for getting another valuable perspective. And I never knew I could get both sets of subtitles on Netflix. That's hugely useful for Japanese since learning the writing system is half the battle."", ""Can't agree with OP more. I do a lot of these things already, mostly the netflix and reading novels while adding vocab to anki which I have synced between my PC and phone. I use hellotalk but, honestly, I'm really bad about voice calling for whatever reason. I suspect if I followed this plan to the T I'd feel perfectly comfortable in Spanish right now, considering how long I've been casually learning it. \n\nI've lately been feeling like I should spend some time learning actual grammar but the thought of it is just so off-putting. Studying grammar is why I never tried for more than a C in high school and had no interest in other languages until 10 years later."", ""Great tips! Quick question though: I'm Polish and I'm quite fluent in English. However, now I'm learning German and I catch myself more and more frequently forgetting essential english vocabulary (e.g cucumber lmao). Is it normal? Now that I've noticed it, I'm trying to think more in English, as its pretty much the only time I speak the language (beides youtube and reddit)."", 'Just want to say for people who don’t really enjoy talking to strangers or in general have hard time practice speaking, writing a journal is a good alternative. Of course you can’t practice speaking by writing forever, but it’s a good temporary solution until you build up your courage :)', ""I have seen several people mention this and what little research I have read on the topic also seems to indicate that target language subtitles are far superior and most people don't seem to learn while using native/advanced level language subtitles. \n\nI learned a lot by using native language subtitles though, so this was somewhat confusing to me until I realized that I spend a lot of time not actually watching the screen while I watch TV shows. I multitask and do dishes or laundry simultaneously and my watching experience frequently turns into half actual watching and half listening only. If there is something I don't understand, I will watch more intently and then read the subs, but if I understand it, I'll look away quite frequently."", 'Thank you for your input! Language learning with Netflix definitely requires some active attention to language learning. For example with the Google extension ""Language Learning with Netflix"", I will sometimes turn on ""auto-pause"" so after each sentence, the video will pause and I can write down some new words before continuing on. This is not an ideal way to watch Netflix if you are trying to enjoy the show, but it\'s been great for learning some new vocabulary :)', 'It\'s true that target language subtitles are superior. But, it\'s also really helpful to have your source language available if you don\'t understand the sentence. This issue of focusing on your source language and tuning out your target language is not a problem with the ""Language Learning with Netflix"" extension because you can blur out the native language until you click it. It\'s quite amazing, and it\'s what I assumed OP was suggesting.\n\nI find that I only need to reveal the source language for particularly strange grammar and for non-literal idioms that I\'ve never heard before. Otherwise, I can just click on individual words I don\'t know or infer from context.', ""With the LLN app they suggested, you can keep the subtitles in only your target subs. The way mine is set up, the translation is blurred out until I mouse over it when I don't understand (or by accident, but whatever lol)."", ""Oh. There's this problem with learning any other language than English that there's much less content with subtitles in the target language, maybe apart from TED talks that are transcribed quite often. But TV series? Forget it.\n\nNetflix is a bitch for not allowing choosing subtitles in any language one would want to watch their content with. In Poland, the available subs are in Polish and English, sometimes also German, French, Russian and Ukrainian. But Hungarian, Lithuanian or Korean for example? You wish. It's such a bummer."", ""Have you tried the extension the OP mentioned, though? It's quite useful. I'm watching a german show and the extension shows me both the English and german subtitles, which I can also set to pause in between each phrase of the dialogue."", ""You're me.  I barely even register that they're speaking in my target language if I'm focused on reading English subs. Target language subs are perfect because I can pause and look up any word I can't guess from context."", ""Yes! That is excellent. I've been trying to find a similar website like Reddit in French or Spanish. If anyone has a website like that, please let me know :)"", 'If you ever want an American tandem partner, I’d love to continue practicing my German with a native speaker. I’m at a B2/almost C1 :)', 'Native American speakers? Also ""Reddit is a very nice possibility to make language process"" sounds a bit weird but definitely understandable. Other than that you speak great English, keep it up!', 'Hey, I know you already have another exchange offer but I would love to practice my german (B2+), am a native English speaker, and would also be very happy to practice french! I’m not a native french speaker but I have a confident level. Let me know if you might be interested (or know any other German speakers who might like to do an exchange!)', 'Thank you for your suggestion! I absolutely agree with you that any level learners can pick up a novel that they want to read in another language. Especially on Kindle, when you can directly highlight words and get a translation :)', ""This! When I was around A2 in French I had a hard time reading short stories because they didn't interest me. I finally decided to dive into Planet of the Apes cause I loved the movies growing up and wanted to see the differences. It was extremely difficult but I never gave up and learn so much vocab from that book!"", 'Yes, I love them! :D', 'Thanks for your feedback! You might want to try some grammar books or Babbel to get down some basic grammar of French. Also with your Anki vocab, I would suggest writing a sentence for each word on a separate sheet of paper to give the words context. Or every time you review the word, try to make a sentence in your head :)', 'No problem! Yes, you can set your native language to a different language :) I was using Spanish as my native language for a while.', ""Yes! Beelingua is awesome! \n\nUnfortunately I don't know if anything like the Chrome extensions for Firefox...hopefully someone else can shed some light on this!"", ""I got to a conversational level in Spanish in about a year. But moving to Bolivia definitely helped with that. It depends on what languages you know and what you're trying to learn. I found that knowing French helped a lot with my Spanish learning and knowing English helps a lot with German!"", ""I've never tried Busuu before! Maybe for my next language :) Thanks for the suggestion!"", ""That's a great question. I'm quite a social person so whenever I'm learning a language, I try to make friends who speak that languages (many through the language exchange apps) and when we build a friendship, I end up practicing my languages as I catch up with these friends :)\n\nAlso dividing my readings/show watching into different languages, like reading the news in Spanish, reading books in French and watching shows in German."", ""That's an excellent suggestion! :D"", 'Not a problem! Let me know how you like them :)', ""I've never heard of that one before, I'll check it out :)"", 'Not a problem! Hope you find some of these tips helpful :)', 'Thanks for your suggestions! I hope you find some Icelandic resources soon. Perhaps you can try Amazon for grammar books or check Hellotalk to see if they offer Icelandic :)', 'Not a problem! I hope you find some of these tips helpful :)', 'Not a problem! I hope you find some of these tips helpful :)', 'No problem! Hope you find some of these tips useful :)', ""That's an excellent idea! Thank you for the suggestion 😊"", ""Haha that's definitely not a lie to say you're on your 4th language! You still had to learn the other 3 somehow :)\n\nGlad to hear others are finding these strategies effective as well! Keep up the good work!"", 'Not a problem! Hope you find some of these tips helpful :)', ""It's like how I learned the genders of nouns in French and Spanish...pure memorization 😅 I definitely mix this up all the time, but I think to have a conversation and to be understood, people are generally quite forgiving for these types of mistakes :)"", 'No hay problema! Me alegra que te gustó mi post :)', 'Glad to hear you found these tips useful, Tatiana! I enjoyed having you in class today :)', 'Thank you! :)', 'Thank you for your feedback! And I find it very fun as well to learn two languages simultaneously! Feels much more productive haha :)', 'Thank you! :)', ""That's a good point. I guess it would depend on how comfortable you are with the language you're using to learn another language. Learning French through Spanish would definitely make more sense since the two languages are similar in many ways. For me, learning German through English would make more sense than learning it through French, but I prefer to have the French review while learning German rather than using my native language :)"", ""Thank you! \n\nI've become interested in language learning about 5 years ago when I attended a french immersion summer program in Quebec, Canada. And yes! I've used all the tips I've suggested and using a combination of them has helped me tremendously in my language learning :)"", 'Not a problem! I hope you find them useful :)', 'Yeah, the uncommon languages can be quite tricky to find resources...just another a supply and demand market 😅', 'Glad you liked it! :)', 'You can check and see if the apps I recommended have that language. Otherwise, perhaps Youtube has videos to teach common phrases in the Darija and if you can find any shows or books in this language as well, you can use those as well.\n\nYou can also try posting on this thread on Reddit to see if anyone has resources for learning Darija! I find the language learning community to be very helpful and supportive :)', ""That I have no idea, unfortunately. But you can send them a message on their Instagram page and ask! They're usually quite good at responding :)"", ""That's a great idea to put the list in an order! I started with Babbel, but even if you know just a few phrases in a new language, you can test it out by using them with a few people :)"", ""I'm 26 :)"", ""I can't really say I learned Mandarin because it's my first language haha. But unfortunately, I can't read or write Chinese, only speak Mandarin. One of my language goals is to learn to read Chinese!  That's the only reason I would put my French above my Mandarin :)"", ""I'll need your email!"", ""That's great!! :)"", ""No problem, Silvio! I'm glad you found these tips useful :)"", 'Hellotalk and Tandem are great language exchange apps to connect with native speakers :)', ""You can try listening to podcasts while you're doing chores or on your commute! Sometimes as I'm washing dishes, I'll put on a language learning podcast or while I'm on the bus or driving :)"", 'hellotalk is great, because if the person you are talking to is comfortable with it you can send them a voice message of you saying something in the language and they can tell you which adjustments to make :)', 'You can set Netflix’s display language to your target language. And suddenly waaaaay more content in your target language is visible and recommended. It’s not the same effect that a VPN has. But it’s a start and 100% legal.\n\nEdit: typo\n\nEdit 2: Changing the display language can be done for each profile separately. So other users will not be affected if you have a shared Netflix account.', ""Are VPNs illegal? They can be used to do illegal things, but I don't think using a VPN on Netflix is illegal"", 'No problem! :)', ""If you decide to use a language exchange app, you can directly put in your profile description that you want to practice Shanghainese. Some Chinese speakers might speak Shanghainese and if you get lucky and meet some people this way, you can also ask them if they have friends who want to practice their English and set up some more language exchange opportunities for yourself.\n\nOther than that, I don't know if there are Youtube videos that directly teach Shanghainese...or if there are shows/podcasts in Shanghainese, but if you meet a language exchange partner who speaks it, they might be able to point you to more resources :)"", 'You can look for meetups that have a title like ""language exchange"" rather than for a specific language. Try searching directly for MundoLingo. Most big cities seem to have a MundoLingo group. If not, there are also some online meetups over Zoom that my friend is hosting. If you are interested, you can send me a PM and I can connect you to him :) \n\nBut with regards to going to in person meetups, you can always just try one time and see what it\'s like. If you didn\'t enjoy it, you don\'t have to go back, but maybe you will enjoy it.\n\nOn Tandem, you can search for people nearby. There could a lot of native speakers of your target language in your area that you didn\'t know about!', 'Thank you for your feedback! Great job with all your languages, keep up the good work! :)', ""Thank you for your feedback!! Grammar can be quite fun sometimes depending on how you learn it. If you can learn it through a game or fun exercises, you may enjoy it more :) I find Babbel to be quite fun, but maybe that's just me hahah"", ""Thank you!\n\nHaha I know what you mean. When you have various languages swimming around your head, you sometimes forget very simple words. I definitely have had that happen to me...so I think it's quite normal! The important thing is to try and use the different languages whenever you can to jog your memory :)"", ""That's a good point! And for that reason, I like the language apps because you can use a stock photo and a fake name and never have to see the other person face to face haha."", ""If you don't understand the sentence, pause and look up the word. Make yourself work. TV is also for enjoyment, and you get better over time. You don't need to understand every word the first time you watch something."", 'LLN makes more subtitle languages available.', 'En français, les forums de jeuxvideo.com !', 'in spanish Taringa is a great place!', 'Yes, why not? I would like to do that ^-^.', ""Thank you :D!\nYeah, I try my best but I'm always grateful for corrections."", ""readlang is a good site too. Afaik kindle doesn't have dictionaries for a lot of languages. With readlang you can get instant translations, plus it'll save a list of all words you click on and that is easily exported to anki. It also saves the full sentence so you can make bulk cards like TL full sentence and TL unknown word on front and then translation on back. Works really well if you want sentence cards from what you're reading."", 'I got a PocketBook cheaper and it has the same functionality and all the dictionaries that I need', ""I'm about A2 in my TL right now and am reading/listening to Harry Potter in it. \n\nWhen you were at the level and reading Planet of the Apes, were you looking up the translation for every word you didn't understand?\n\nI've just been reading/listening without doing any translation, so wondering if that's the right move. (My intent was to just get lots of input of my TL/get more of a feel for pronunciation/the sound of it.)"", 'One of the main reasons I like it, and I wish other materials would do this more often, is they have the lessons in order with CEFR, so you can watch yourself progress from A1 lessons to A2 lessons, B1 to B2 etc... It may not be absolutely perfect but if you have a yardstick like that it motivates you to get to the next level by X date, it makes goal setting easier and easier to track.', 'Thanks for your answer and tips!', 'Thank you haha!', ""I think in Spanish it's much more easier because many nouns are o or a ending and other rules. German is just so hard because of the gender without rules. What level are you in Spanish and German? And aren't mistakes in gender in German worse because of the cases like dem den.."", 'YouTube and my boyfriend have been my only resources lol', 'I did and they’re not much help according to my boyfriend who is native :) I will! Thank you!', 'That’s great to know, thank you!', 'Ok ty :)', 'Here it is: joaobottazzini@gmail.com', 'I sometimes listen to BBC World Service when I go to work or home or try to find streamers who broadcast in English. In the very beginning, I watched ""Jack from [tofluency.com](https://tofluency.com)"" on youtube to improve my listening skills.\n\nDo you have a good source for podcasts?, - there are so many on the internet :-/', 'Yes! The audio messaging option is excellent :D', 'Really? Then why would people even both to use VPNs on Netflix? As, even then, Netflix is missing a lot of shows, as far as I know.', ""They are not illegal, but they are legally grey. If I remember correctly, Netflix's terms of use say that you shouldn't use a VPN to access content outside of your region, or something along the lines of that."", 'Thanks!', 'MundoLingo seemed to only be a few very big cities. Only NYC in the US. My city has ~ 5 million people and no meetup groups for any TLs I speak other than German.\n\nI did sign up for the tandem app. I think you need to pay to see locals, though obviously there won\'t be many. Seems almost like a bit of a dating app, except not meeting in person. 95% of people who message me are of the opposite gender, and 90% of them can\'t carry a conversation (the ""hi"" syndrome). Between my work schedule and time zone differences, it gets kind of hard to have a conversation anyway.', ""Right... then don't click on every word. You can find a rhythm that works for you.\n\nI don't understand your logic though about making yourself do extra work when technology can facilitate the tedious aspects of this process. Turning pages of a dictionary isn't what helps language learning. It's the content that matters."", ""yeah, I know, it's just a shame we have to resort to using web extensions for what (imo) should be provided by Netflix"", 'Thank you! :)', 'Thank you!', 'Just PM me whenever!', 'Not to pile on you, just to add on to what the other commenter said, the appropriate word there is ""opportunity.""', ""Oh that's great! I haven't heard of PocketBook before. I will check that out for gift ideas :)"", 'So it would depend on my mood. If I felt more motivated I would look up words and add to anki. If i had a rough day I´d read and try to understand as much as possible. At minimum I wanted to read a certain amount everyday but found translating sometimes discouraged me from doing so.', ""Oh that's great! Babbel should incorporate that as well haha. But Busuu sounds like a good alternative, I'll definitely give it a try next time :)"", 'Not a problem! All the best with your language journey :)', 'Ah yes...the accusative and dative...gives me a headache just thinking about them haha. \n\nMy German is at a beginner level and my Spanish is intermediate :)', ""It's always great to have a native speaker to practice with! Perhaps you can find some grammar books on Amazon :)"", 'Which language are you trying to find podcasts in?', ""With VPN you get shows that aren't available in your region. This is different than a language setting prioritizing available shows in the target language."", ""Netflix's terms and conditions have nothing to do with being legally grey."", ""Really? I didn't know that, thanks for sharing."", 'Oh..I had no idea about those Netflix terms :S', ""That's too bad MundoLingo isn't in your city! I've attended MundoLingo in China, New Zealand and Canada but those were in some of the bigger cities. Hopefully someone starts a MundoLingo group in your city soon! I was planning to start one in my current city, but didn't end up having the time to manage it. \n\nYeah language exchange apps can sometimes feel like a dating app...which is why I send messages to a ton of women (I'm a woman haha) and hope to find a good language partner. I've made quite a few good female friends! Also male friends as well who aren't there to pick up women. Just be patient and filter through the people more :) also Tandem has recommendations, so you can read what other people wrote about them before you decide to have a conversation."", ""People forget things when they don't have to work to figure it out. When everything is at your fingertips, it's easy to forget everything. The curse of technology. Sometimes less is more.\n\nNo need for a physical dictionary. Can still use an online one. I like to write down a list of words each day I wanted to know and look it up when I'm sitting in front of a computer."", 'Yeah I definitely agree about translating discouraging you from reading. I find that I can fully pay attention and really focus to try to understand as much as possible, but was definitely worried about the need to translate constantly throwing me off that rhythm. Your system sounds good though!', 'Do you use CEFR for what level you are? A beginner\nis A1 or a2', 'I never thought of that, thanks!', ""English is the language which I'm looking for. Sorry for not mention it in the first place."", 'Oh, ok. That makes more sense. Does it show you shows that are usually in a different language, but which have dubs in the language you set your Netflix account to?', ""Does not breaking the terms and conditions of a service that you are subscribed to count as being legally grey, since you legally aren't supposed to do it?"", 'Yep, if you get caught doing it they delete the account', ""My problem here is trying to find a less legally-grey way to watch foreign shows, but I don't know of any good way, if there even is any."", 'Well I do have more women messaging me than on a regular dating app heh (I\'m a guy). Maybe I used a better picture. I had been traveling and not spent one second sitting at a desk the previous 2 weeks. Maybe I should make a regular old profile as an experiment. Most of the guys on tandem who interact with me don\'t say anything, they just follow. Not sure what that means on the app. Am I supposed to post things like on Facebook ..\n\nSpeaking of recommendations, every single one I saw was ""this girl is beautiful, you won\'t regret talking to her!!"" lol ...\n\nDo people use them to make longer term friends or have a quick chat with lots of people? There are certainly some dating parallels I suppose.\n\nI\'m definitely not good when the girl says nothing more than hi and expects me to carry the whole conversation, much like OLD.', ""I haven't tested either languages for CEFR levels, but I would say my German is hovering between A1 and A2 and Spanish is probably between B1 and B2 :)"", 'Ahhh okay! I would recommend TEDx and The Tim Ferriss Show for podcasts :)', 'Unfortunately that’s not easily visible. You have to check each show. :-(', ""No, a company doesn't make laws or statutes of a country based on their terms of service."", 'Maybe on YouTube? Some TV companies upload episodes of their programs on YouTube', ""Maybe buying the dvd if it has your TL as an option? \n\nDepends on the language of course, but for some (like my TL) it's quite normal that people access stuff however they can because unless you're in the country you don't really have another choice"", 'I\'m more familiar with Hellotalk than Tandem, so I\'m not quite sure what ""following"" on Tandem does haha. \n\nI\'ve made a few long-term friends through Tandem and got to meet some of them during my travels, but Hellotalk I\'ve started using 5 years ago and some of my best friends to this day I\'ve met through that app. So it really depends on the individual person. \n\nThere are a lot of people on these apps who cannot carry out a conversation haha, but once you find a few who can, it becomes so helpful for your language learning :)', 'thats cool :) for german you might like using nicos weg dw https://learngerman.dw.com/en/overview and forvo or wiktionary for pronunciation.', ""So then what would changing your region's language do if it didn't show you shows with a dub in the language you set your account to?"", 'Can they not sue or fine you in some circumstances for breaking their rules?', ""That would work for a few shows, but if you wanted a lot of shows in your target language, wouldn't that be super expensive? I don't know about DVD prices across the world, but in Japan, they are often around 50% to twice the price of DVDs in America."", ""I ran my experiment and put the same pic on an OLD platform with no text on my profile at all, and definitely a lot more likes/messages than previous times I've used that. So it's definitely the pic.\n\nI have had a couple decent conversations on Tandem, but other than those, it definitely has the dating vibe with 90-95% of the people messaging me being of the opposite sex. But also seems to be a lot of Russians just wanting to use the app as a one-way street. Speaking all English and none of their native language. I've read that one-way-street culture is a bit worse with speakers of some languages than others. Then the other thing is a lot of the people are 18-22. I just have trouble connecting to people in that age range, English or not, dating or not. Way too old for that.\n\nI guess the spammy factors don't matter too much if you do find a couple interesting people to practice with. Maybe I'll try out HelloTalk and see what happens, or if it's the same user base anyway."", 'Thank you for the suggestion! :)', 'It messes with the algorithm of what shows are more likely to be shown to you. Netflix has a huge catalogue and after changing the language you see mainly \n\n- shows from the country of origin of the language\n- shows in that language\n\nBut also\n\n- shows that have only subs in that language. \n\nAlso, if the language is spoken in different countries with different dialect, you have to test-watch a show, to find out, which dialect it has. \n\nChanging the language basically has the effect, that Netflix hides shows, which would not be understood by somebody who only speaks this one language. \n\nFor example, if you want to learn Italian- if it is set to Italian, you don’t see shows that are only available in English with subtitles in German and Turkish. \n\nLong story short: after changing the language it is easier to find relevant content, but you still have to put a bit of work in it.\n\nEdit: it works in both ways: again, if you want to learn Italian. -> if you don’t change your language and stay at for example English as display language - then you probably won’t be able to see certain Italian shows (if those shows have no English subs/dubs) .... because Netflix thinks those shows are not relevant to you', ""Well you didn't ask for a cheap option, just a legal option.\n\nNot sure about other places either, but I know for a fact here in the UK that charity shops often don't even accept donations of dvds / CDs because they receive so many of them and so few people buy them. So you can buy them second-hand for cheap. You can also easily buy them in bulk for next to nothing. It's just a suggestion seeing as you wanted a legal option."", ""Thanks for reporting back! There should be a filter to change the age and gender of your target. Also, if you feel like it's becoming a one-way street, just ask them something like can we practice both languages? Maybe you can do one day of their target language and one day of your target language. \n\nYeah give Hellotalk a try and see what you think!"", ""Thanks for the advice. But still, it is absolute madness that even in 2020, there is no easy and affordable way to access foreign content, even though there are a million ways to easily and affordably access content that isn't foreign."", 'Maybe I should just delete Tandem and try HT.\n\nHad a conversation scheduled with someone. Was clear about time zones, still showed up at wrong time. Ok fine, couple hours later was fine. All of a sudden went from she wanted a conversation to let me send you these documents to read on your phone and test your reading skills, let\'s do a lesson. I\'m guessing it\'s a scam to try to get me to pay for lessons or something.\n\nAt the same exact time, while not having had any new contacts the past few days (since my profile was no longer new), I suddenly got messages from 4 or 5 different people at the exact same time. Some with the same name, mostly just saying hi. One asking me some random question about a country I\'ve never been to where they speak a language I don\'t speak or list on my profile. I just said don\'t know, and she came back with ""what a lazy answer, did you write that yourself or did you get your black person to write it for you?""\n\nThis is why I hate free things. Considering I have a good job, probably better to just buy an italki lesson. Time has value.', 'You\'re lucky you\'re learning Spanish and not an uncommon language then. Spanish has tons of content available in comparison.\n\nProbably not what you wanted but I\'ve always went with the line of thinking of ""if I genuinely can\'t get it legitimately then the \'grey\' option is fine"" - especially if you are already paying for it in another language but they don\'t have your TL', ""Wow, sorry you received that answer by the crazy lady...\n\nOn these apps it's really hit or miss, but when you find the right people who become good language exchange friends, it's worth it! \n\nBut if you have the money and not so much free time, then buying an lesson on italki would be a good way to go. Especially if your goal is just to improve your language, rather than making friends from different cultures.\n\nI've met probably 20 friends in real life from Hellotalk and Tandem over the years and some of them are my closest friends to this day, but then again, I've probably chatted with over 200 people, so a lot of filtering had to be done xD""]"
