Title,Body,URL,Score,Comments Count,Comments
I just finished reading my first book in German,"I've been ""learning"" German for about 2 years, but other than the beginning, here and there, and since about a month ago, I have been extremely lazy with learning and procrastinated a lot. Highschool not being great at teaching languages doesn't really help, as everything I was ""learning"" was stuff I already learnt in the first month on my own.

I didn't want German to be just another failed venture like my past languages.

I finally decided I'd set a goal and so started reading der kleine Prinz a few weeks ago. Brute forced ~last half of the book in the last few days because it's summer break. 

Great book, both story-wise and for learning. I've added 600+ words in my Anki deck that I previously didn't know, and am doing 25 new words a day at the moment.

Are there any books you guys suggest I read next? Intermediate stuff. I find children books and ""for learners"" books really dry in plot. I know Little Prince is a ""children"" book but it's enjoyable for adults too.

Probably going to try Harry Potter (and continue news articles) next, unless someone has a better suggestion.",https://www.reddit.com/r/languagelearning/comments/8pukla/i_just_finished_reading_my_first_book_in_german/,11,9,"['If you already read Harry Potter in English I think it would be a good idea to start that. Otherwise I would read another simpler book first and learn more words, then start HP.', ""I'm in no way an expert on the German language but I think Grimm's fairy tales can be very useful since they are written for children amd thus resembles more or less the day-to-day way of speaking. I'm not familiar with the way it's written, so it might be rather arhaic.\n\nThey have been around for quite some time so they're in the public domain, which meand you can legally download them.\n\nAfter a quick search I found this:\nhttps://www.grimmstories.com/de/grimm_maerchen/index\n\n"", 'Simpler and short could for example be „Farm der Tiere“ by George Orwell', ""In terms of classics, Siddhartha by Hesse is short and the language is rather simple. \n\nParfum by Süßkind is also very exciting. The language isn't the easiest but the story is so gripping that it will hold your interest. \n\nI also recommend finding a German translation of a book that you've already read and really love, even if the book is a bit tricky. Your memory can fill in a lot of the comprehension gaps."", 'I actually quit reading halfway through the 7th book, so hoping to find out what happens finally.\n\nDo you know any simpler or short novels? Preferably something old/famous and translated worldwide\n', 'Thanks, I somehow forgot about them.', 'Oh yes! I read that 2 years ago for school, and liked 1984 when I read on my own. \n\nI’ll be sure to read that', ""Not the PP but the 7th book would be way too hard to start with - if you're gonna do HP, start over with the 1st book. The language difficulty actually ramps up through the series as the characters and fan base matured.\n\nI can also answer your question: The Alchemist is famous and has been translated far and wide. It's relatively simple as far as books go and it was actually the first book I read in German. I read it again 2.5 years after the first time and understood almost entirely every word, sentence and phrase (maybe like 3-10 exceptions in the entire book), so I'd put the book at a low to mid B2 level, but that doesn't mean you can't read it at a lower level, which is what I did reading it at about A1.5~A2 the first time around. Here is a pdf of the German book online: http://liebevoll-wei.se/Der_Alchimist.pdf . And yes mods, this is legal; it was put up with permission from the publisher."", 'Oh ofcourse I will read from the beginning. I’m gonna read all + the alchemist thanks']"
